{
  "$schema": "https://json-schema.org/draft/2020-12/schema",
  "$id": "urn:egma:simulation-contract:spec:v1",
  "title": "Simulation spec",
  "description": "The spec direction of the simulation contract: what the control plane hands the simulator when a queued simulation is claimed. The spec is fully flattened — the simulator receives no identifiers to resolve, no database to ask, and everything it needs to conduct one simulation from birth to a terminal report. This is the only direction credential material ever travels; the report schema (urn:egma:simulation-contract:report:v1) structurally forbids it coming back.",
  "type": "object",
  "additionalProperties": false,
  "required": [
    "contract_version",
    "simulation_id",
    "modality",
    "connection",
    "persona",
    "scenario",
    "limits"
  ],
  "properties": {
    "contract_version": {
      "description": "Which version of the simulation contract this document speaks. A simulator refuses a spec whose version it does not implement; it never guesses at fields it does not know.",
      "type": "integer",
      "const": 1
    },
    "simulation_id": {
      "description": "The simulation this spec conducts, echoed verbatim on every report about it. Opaque to the simulator: never parsed, never minted, never rewritten.",
      "type": "string",
      "minLength": 1
    },
    "modality": {
      "description": "Which layer is under test. Chat exercises the agent's harness — prompt, reasoning, tools; voice exercises the harness plus the speech stack. The modality selects the pipeline legs; the persona brain is the same for both.",
      "type": "string",
      "enum": ["chat", "voice"]
    },
    "connection": {
      "description": "How the simulator reaches the agent under test. Connection kind selects the adapter, access variant selects the authority and configuration inside it, and agent platform records what runs the target without selecting code.",
      "type": "object",
      "additionalProperties": false,
      "required": ["agent_platform", "connection_kind", "access_variant", "config", "credentials"],
      "properties": {
        "agent_platform": {
          "description": "The product or framework that runs or exposes the agent, or null when unknown. It records provenance and never selects simulator code.",
          "oneOf": [{ "type": "string", "minLength": 1 }, { "type": "null" }]
        },
        "connection_kind": {
          "description": "The direct path the simulator selects. It is an open vocabulary so a simulator without the named adapter can refuse it clearly at runtime.",
          "type": "string",
          "minLength": 1
        },
        "access_variant": {
          "description": "The configuration and authority used inside the selected connection kind. It is explicit and is never inferred from config keys.",
          "type": "string",
          "minLength": 1
        },
        "config": {
          "description": "The non-secret reach configuration, exactly as stored on the connection. Its keys belong to the selected access variant; this schema does not know them.",
          "type": "object"
        },
        "credentials": {
          "description": "The resolved secret material for this connection, unsealed by the control plane for exactly this hand-off, or null where the access variant takes no customer secret. The simulator holds it in memory, hands it only to the adapter, and never logs, persists, or reports it.",
          "oneOf": [{ "type": "object" }, { "type": "null" }]
        }
      }
    },
    "persona": {
      "description": "Who does the talking on the human side of the transcript.",
      "type": "object",
      "additionalProperties": false,
      "required": ["traits"],
      "properties": {
        "traits": {
          "description": "The persona's authored traits, exactly as saved on the version the run pinned — today personality, language, and the concrete voice. Passed through opaquely: what a persona is made of is authoring's business, and the simulator composes these with the scenario instructions into the persona brain's system prompt.",
          "type": "object"
        }
      }
    },
    "scenario": {
      "description": "What the persona wants on this occasion — the situation, from the test's own content. The persona says who; the scenario says why they are here today.",
      "type": "object",
      "additionalProperties": false,
      "required": ["instructions"],
      "properties": {
        "instructions": {
          "description": "The scenario as instructions to the persona brain: the goal, the circumstances, and anything the persona knows going in.",
          "type": "string",
          "minLength": 1
        }
      }
    },
    "limits": {
      "description": "The walls around one simulation. A limit tripping ends the simulation deliberately, reported with ending `limit_reached` — which is never the agent failing, and never graded as if it were.",
      "type": "object",
      "additionalProperties": false,
      "required": ["max_duration_seconds", "max_turns"],
      "properties": {
        "max_duration_seconds": {
          "description": "The most wall-clock seconds the simulation may run, measured from when the simulator begins conducting it.",
          "type": "integer",
          "minimum": 1
        },
        "max_turns": {
          "description": "The most transcript turns the simulation may reach, counting both speakers.",
          "type": "integer",
          "minimum": 1
        }
      }
    },
    "mock_tools": {
      "description": "The answers this simulation serves for the agent's tools, already resolved: one entry per tool name, the project's default or the test's override, whichever applies — worked out once by the control plane so that every simulation in one run sees one world and nothing downstream can reach a second answer. Absent, which is the ordinary case, means egma answers for nothing: every tool the agent has runs its own implementation, untouched and unobserved. Order is the order the answers were authored, and it is stable so that two runs of one project read alike.",
      "type": "array",
      "items": { "$ref": "#/$defs/mock_tool" }
    },
    "platform": {
      "description": "What this deployment has been configured with, unsealed for exactly this hand-off: who the persona thinks with, what it speaks and hears with, and how a call reaches the telephone network. These belong to the whole deployment rather than to any customer on it, and they used to live in each simulator's own environment — which meant a second simulator on another machine needed a file copied to it, and a container started without one dialled nothing while reporting itself healthy. They ride this document instead, through the same door and with the same authority as the connection's credentials beside them, and are read afresh for each simulation so a changed key applies to the next one with no restart. Every block is optional and so is every field inside it: a setting the platform does not hold leaves the simulator's own value standing, and a setting it does hold replaces it. A platform that has configured nothing sends nothing, and a simulator conducts exactly as it did before this block existed.",
      "type": "object",
      "additionalProperties": false,
      "properties": {
        "model": { "$ref": "#/$defs/platform_model" },
        "speech": { "$ref": "#/$defs/platform_speech" },
        "carrier": { "$ref": "#/$defs/platform_carrier" }
      }
    }
  },
  "$defs": {
    "platform_model": {
      "description": "What the persona thinks with. Every field is optional, because a platform mid-setup holds some of them and not others, and one that holds none of them is every platform before anybody set it up.",
      "type": "object",
      "additionalProperties": false,
      "properties": {
        "provider": {
          "description": "Which client speaks to the model — the simulator's own open vocabulary, not an enum here: a simulator holding no client for a provider refuses at runtime with the ones it has, rather than this schema refusing the document.",
          "type": "string",
          "minLength": 1
        },
        "model": {
          "description": "Which model to ask for, verbatim as the provider names it. Configuration rather than a constant of the product: providers retire and add models on their own schedule.",
          "type": "string",
          "minLength": 1
        },
        "key": {
          "description": "The provider key, in the clear for exactly this hand-off. Held in memory for the simulation, registered for redaction, and never logged, persisted or reported. No report document has anywhere to put it.",
          "type": "string",
          "minLength": 1
        },
        "reasoning_effort": {
          "description": "How hard the model should think before the persona speaks, in the provider's own vocabulary — an open string, not an enum here, because the accepted values differ between providers speaking one chat-completions shape and have grown more than once. Absent means send nothing at all, which is what keeps a model that has never heard of the field working exactly as it did. A persona is a caller in a hurry rather than a puzzle-solver: the reasoning under test is the agent's, and every moment the persona spends thinking is silence on a live line that no real caller would leave.",
          "type": "string",
          "minLength": 1
        }
      }
    },
    "platform_speech": {
      "description": "What the persona speaks and hears with on a voice simulation, and what tells it the agent has started and stopped speaking. A key per leg rather than one per provider: the two legs are two accounts as often as they are one, and a shape that could not say so would make the second one unreachable.",
      "type": "object",
      "additionalProperties": false,
      "properties": {
        "stt_provider": {
          "description": "The persona's ears. An open vocabulary, refused at runtime by the simulator holding no such leg.",
          "type": "string",
          "minLength": 1
        },
        "stt_key": {
          "description": "The listening leg's provider key, on the same terms as the model key above.",
          "type": "string",
          "minLength": 1
        },
        "stt_model": {
          "description": "Which model the listening leg asks for, where its provider has more than one. Here beside tts_model rather than left in each simulator's environment, which is where it used to live alone: that asymmetry was the one speech setting a deployment could not change centrally, so moving the persona's mouth was a settings page and moving its ears was editing a container and restarting it.",
          "type": "string",
          "minLength": 1
        },
        "tts_provider": {
          "description": "The persona's mouth. Chosen apart from the ears on purpose — a real mouth with scripted ears is a configuration somebody will want.",
          "type": "string",
          "minLength": 1
        },
        "tts_key": {
          "description": "The speaking leg's provider key, on the same terms as the model key above.",
          "type": "string",
          "minLength": 1
        },
        "tts_model": {
          "description": "Which model the speaking leg asks for, where its provider has more than one.",
          "type": "string",
          "minLength": 1
        },
        "tts_voice": {
          "description": "Which voice the speaking leg asks for when the persona's own traits name none.",
          "type": "string",
          "minLength": 1
        },
        "vad_provider": {
          "description": "What tells the persona the agent has started or stopped speaking. Needs no key either way.",
          "type": "string",
          "minLength": 1
        }
      }
    },
    "platform_carrier": {
      "description": "How a call reaches the telephone network: which bridge places it, and the trunk the carrier authenticates. Absent on every deployment that has never been given a carrier — which still runs chat and voice simulations perfectly well — and that absence is an ordinary state rather than a fault. The media server's own key and secret are deliberately not here: they are read by a third-party container when it is created and cannot come from the platform's store, so they stay in each simulator's environment.",
      "type": "object",
      "additionalProperties": false,
      "properties": {
        "media_backend": {
          "description": "Which driver places the call. An open vocabulary, refused at runtime by a simulator holding no such backend.",
          "type": "string",
          "minLength": 1
        },
        "trunk_address": {
          "description": "The carrier hostname a call is routed through. Non-secret: it is a fact the readiness answer already reports.",
          "type": "string",
          "minLength": 1
        },
        "trunk_number": {
          "description": "The number a call appears to come from, E.164. Non-secret, for the same reason.",
          "type": "string",
          "minLength": 1
        },
        "trunk_username": {
          "description": "The username the carrier authenticates the trunk by.",
          "type": "string",
          "minLength": 1
        },
        "trunk_password": {
          "description": "The password beside it, in the clear for exactly this hand-off and on the same terms as every other secret in this document.",
          "type": "string",
          "minLength": 1
        }
      }
    },
    "mock_tool": {
      "description": "One tool name, and what egma answers when the agent calls it. Matching is by the name and strictly by it: a mock tool never reads a call's arguments, so there is no matcher here and nowhere for one to go.",
      "type": "object",
      "additionalProperties": false,
      "required": ["tool_name", "answer", "delay_milliseconds"],
      "properties": {
        "tool_name": {
          "description": "The agent's own name for the tool, verbatim. Never parsed, never folded, never matched loosely.",
          "type": "string",
          "minLength": 1
        },
        "answer": { "$ref": "#/$defs/mock_tool_answer" },
        "delay_milliseconds": {
          "description": "How long egma holds the answer back before serving it, so a mocked backend takes as long as the real one would. The ceiling is arithmetic rather than taste: the exchange carrying an answer has a 45-second budget, of which 10 seconds is allowed for the round trip and 5 for egma's own serving margin — so 30 000 is what is left, and a delay this document admits can never collide with the transport that has to carry it.",
          "type": "integer",
          "minimum": 0,
          "maximum": 30000
        }
      }
    },
    "mock_tool_answer": {
      "description": "What the tool returns, or the failure it raises — travelling in the shape it is served in, so nothing between the authoring and the wire re-tags it. Two shapes rather than one with a nullable failure, because `null` is a perfectly good answer for a tool to give and a shape that could not tell it from 'no answer' would make an authored `null` unserveable. Exactly one of the two keys is ever written.",
      "oneOf": [
        {
          "type": "object",
          "additionalProperties": false,
          "required": ["answer"],
          "properties": {
            "answer": {
              "description": "The value the tool returns, of whatever shape its own contract has — including `null` and bare scalars. Bounded by what the exchange carrying it holds: 15 KiB once serialized, refused at authoring time with the honest reason."
            }
          }
        },
        {
          "type": "object",
          "additionalProperties": false,
          "required": ["error"],
          "properties": {
            "error": {
              "description": "The failure the tool raises, as text — how a test orders up the branch a real backend cannot be asked for.",
              "type": "string",
              "minLength": 1
            }
          }
        }
      ]
    }
  }
}
