{
  "contract_version": 1,
  "simulation_id": "sim_01K3XQ7M4E8YB2FVN0H9TZQWER",
  "modality": "chat",
  "connection": {
    "agent_platform": "retell",
    "connection_kind": "retell_chat_api",
    "access_variant": "retell_chat_api.api_key",
    "config": {
      "retellAgentId": "agent_2f6c9e8d7b5a4c3e2f1d0a9b8c"
    },
    "credentials": {
      "apiKey": "fixture-not-a-real-secret-0000000000000000"
    }
  },
  "persona": {
    "traits": {
      "personality": "Margaret, 68, retired schoolteacher. Polite but easily flustered; asks for things to be repeated and apologises for it.",
      "language": "en-US",
      "voice": {
        "provider": "cartesia",
        "voiceId": "warm-alto-2",
        "speed": 0.9
      }
    }
  },
  "scenario": {
    "instructions": "You booked a dental cleaning for next Tuesday and need to move it to Thursday the same week. You do not remember the exact time of the original appointment. Conclude once the new time has been read back to you."
  },
  "limits": {
    "max_duration_seconds": 600,
    "max_turns": 60
  }
}
